{"cell_id":"c-decision-gate-nccl-2.20.5-tree-l-r000000-2930799903e9a040","cell_identity_sha256":"2930799903e9a040a4ec10243f121785780a913f4190a65c09547aaeb124e359","measurement":{"attempt_id":"a-000001","correctness_check_count":8,"count":20,"decision_claims":{"physical_decision_fidelity":"not_analyzed","physical_execution":"same_allocation_self_reported","qualification_verdict":"policy_bound_not_issued"},"execution":{"iterations":20,"order_method":"iteration-rotated-latin-cycle.v1","representation_order_by_iteration":[["source","exact_work","stratified","isolated","no_overlap","no_rank_skew"],["exact_work","stratified","isolated","no_overlap","no_rank_skew","source"],["stratified","isolated","no_overlap","no_rank_skew","source","exact_work"],["isolated","no_overlap","no_rank_skew","source","exact_work","stratified"],["no_overlap","no_rank_skew","source","exact_work","stratified","isolated"],["no_rank_skew","source","exact_work","stratified","isolated","no_overlap"],["source","exact_work","stratified","isolated","no_overlap","no_rank_skew"],["exact_work","stratified","isolated","no_overlap","no_rank_skew","source"],["stratified","isolated","no_overlap","no_rank_skew","source","exact_work"],["isolated","no_overlap","no_rank_skew","source","exact_work","stratified"],["no_overlap","no_rank_skew","source","exact_work","stratified","isolated"],["no_rank_skew","source","exact_work","stratified","isolated","no_overlap"],["source","exact_work","stratified","isolated","no_overlap","no_rank_skew"],["exact_work","stratified","isolated","no_overlap","no_rank_skew","source"],["stratified","isolated","no_overlap","no_rank_skew","source","exact_work"],["isolated","no_overlap","no_rank_skew","source","exact_work","stratified"],["no_overlap","no_rank_skew","source","exact_work","stratified","isolated"],["no_rank_skew","source","exact_work","stratified","isolated","no_overlap"],["source","exact_work","stratified","isolated","no_overlap","no_rank_skew"],["exact_work","stratified","isolated","no_overlap","no_rank_skew","source"]],"source_event_count":8,"stratified_method":"first-observed-per-collective-shape.v1","stratified_source_event_indices":[0,1],"timing_semantics":"maximum-rank-cuda-event-whole-program-duration","warmup":5,"world_size":4},"global_ranks":[0,1,2,3],"iqr_us":167.93600000000015,"materialization":{"materialization_id":"e3db603d13fd8699a15af3a5d59c69d5301a97c22b0f8830d5b9b71e04b21f37","program_sha256":"2a3e80aed7cdafa78333aa74395fd5e90b37169becde7ea5e53c010cd4ce4005"},"operation":"all_reduce","policy":{"format":"commcanary.qualification_policy.v1","policy_id":"26180cd435f33ec24f212ceb58aea25390320efb311a460554100349ba6e5acb"},"representations":{"exact_work":{"category":"product_candidate","executed_event_count":8,"metrics":{"count":20,"iqr_us":113.664,"max_us":1605.632,"median_us":1447.936,"min_us":1242.112},"rank_timings_us":[[1553.408,1593.344,1444.864,1438.72,1496.064,1500.16,1571.84,1572.864,1496.064,1328.128,1397.76,1398.784,1426.432,1375.232,1443.84,1386.496,1431.552,1462.272,1341.44,1231.872],[1563.648,1604.608,1457.152,1447.936,1497.088,1505.28,1573.888,1576.96,1504.256,1325.056,1396.736,1403.904,1428.48,1379.328,1447.936,1395.712,1443.84,1471.488,1350.656,1242.112],[1561.6,1605.632,1455.104,1446.912,1502.208,1511.424,1575.936,1579.008,1509.376,1326.08,1396.736,1401.856,1428.48,1376.256,1447.936,1394.688,1443.84,1470.464,1350.656,1241.088],[1563.648,1602.56,1455.104,1447.936,1503.232,1511.424,1577.984,1580.032,1508.352,1341.44,1396.736,1402.88,1429.504,1380.352,1446.912,1393.664,1443.84,1470.464,1366.016,1234.944]],"semantics":"verified-materialization-issue-rank-work-wait","template_count":8,"timings_us":[1563.648,1605.632,1457.152,1447.936,1503.232,1511.424,1577.984,1580.032,1509.376,1341.44,1397.76,1403.904,1429.504,1380.352,1447.936,1395.712,1443.84,1471.488,1366.016,1242.112]},"isolated":{"category":"incumbent_baseline","executed_event_count":8,"metrics":{"count":20,"iqr_us":120.832,"max_us":1619.968,"median_us":922.112,"min_us":701.44},"rank_timings_us":[[967.68,948.224,954.368,1604.608,992.256,901.12,904.192,985.088,899.072,921.6,914.432,920.576,823.296,818.176,911.36,832.512,925.696,814.08,828.416,691.2],[974.848,956.416,962.56,1618.944,995.328,905.216,907.264,988.16,902.144,926.72,919.552,955.392,828.416,822.272,920.576,837.632,931.84,819.2,837.632,699.392],[975.872,954.368,961.536,1618.944,999.424,909.312,911.36,988.16,905.216,927.744,919.552,955.392,829.44,822.272,920.576,838.656,931.84,822.272,836.608,701.44],[973.824,953.344,963.584,1619.968,998.4,909.312,912.384,989.184,907.264,922.624,921.6,956.416,829.44,826.368,922.624,838.656,931.84,822.272,839.68,701.44]],"semantics":"full-message-sequence-blocking-all-reduce-no-compute","template_count":2,"timings_us":[975.872,956.416,963.584,1619.968,999.424,909.312,912.384,989.184,907.264,927.744,921.6,956.416,829.44,826.368,922.624,838.656,931.84,822.272,839.68,701.44]},"no_overlap":{"category":"causal_ablation","executed_event_count":8,"metrics":{"count":20,"iqr_us":123.392,"max_us":2876.416,"median_us":2037.76,"min_us":1638.4},"rank_timings_us":[[2059.264,2083.84,2829.312,2059.264,2065.408,2014.208,2011.136,2035.712,2126.848,1938.432,1939.456,1952.768,1976.32,1941.504,2003.968,1983.488,1971.2,1933.312,1927.168,1611.776],[2069.504,2094.08,2837.504,2076.672,2077.696,2013.184,2011.136,2032.64,2123.776,1938.432,1939.456,1950.72,1968.128,1941.504,2004.992,1982.464,1980.416,1945.6,1936.384,1620.992],[2110.464,2138.112,2846.72,2113.536,2117.632,2068.48,2063.36,2082.816,2179.072,1955.84,1957.888,1970.176,1987.584,1960.96,2021.376,2004.992,1998.848,1964.032,1956.864,1638.4],[2105.344,2131.968,2876.416,2110.464,2116.608,2063.36,2058.24,2081.792,2173.952,1983.488,1981.44,1994.752,2014.208,1987.584,2049.024,2026.496,2026.496,1989.632,1983.488,1633.28]],"semantics":"blocking-all-reduce-then-exact-rank-work","template_count":8,"timings_us":[2110.464,2138.112,2876.416,2113.536,2117.632,2068.48,2063.36,2082.816,2179.072,1983.488,1981.44,1994.752,2014.208,1987.584,2049.024,2026.496,2026.496,1989.632,1983.488,1638.4]},"no_rank_skew":{"category":"causal_ablation","executed_event_count":8,"metrics":{"count":20,"iqr_us":74.24,"max_us":1218.56,"median_us":1064.96,"min_us":974.848},"rank_timings_us":[[1099.776,1102.848,1096.704,1087.488,1081.344,1096.704,1074.176,1077.248,1070.08,1020.928,1047.552,1028.096,1038.336,1215.488,1036.288,1044.48,1006.592,1003.52,1013.76,951.296],[1110.016,1111.04,1106.944,1096.704,1080.32,1098.752,1072.128,1081.344,1072.128,1019.904,1045.504,1025.024,1034.24,1218.56,1036.288,1042.432,1022.976,1015.808,1027.072,972.8],[1110.016,1113.088,1108.992,1097.728,1091.584,1106.944,1084.416,1089.536,1079.296,1019.904,1046.528,1025.024,1030.144,1217.536,1037.312,1044.48,1024.0,1019.904,1027.072,973.824],[1110.016,1114.112,1111.04,1096.704,1090.56,1106.944,1083.392,1087.488,1080.32,1022.976,1049.6,1027.072,1036.288,1198.08,1038.336,1045.504,1025.024,1018.88,1028.096,974.848]],"semantics":"issue-rank-zero-work-on-every-rank-wait","template_count":8,"timings_us":[1110.016,1114.112,1111.04,1097.728,1091.584,1106.944,1084.416,1089.536,1080.32,1022.976,1049.6,1028.096,1038.336,1218.56,1038.336,1045.504,1025.024,1019.904,1028.096,974.848]},"source":{"category":"ground_truth","executed_event_count":8,"metrics":{"count":20,"iqr_us":167.936,"max_us":2313.216,"median_us":1462.272,"min_us":1302.528},"rank_timings_us":[[1675.264,1422.336,1426.432,1567.744,1530.88,1617.92,1543.168,1560.576,1566.72,1427.456,1379.328,1417.216,2309.12,1357.824,1413.12,1393.664,1399.808,1488.896,1380.352,1295.36],[1670.144,1433.6,1443.84,1576.96,1529.856,1618.944,1540.096,1562.624,1568.768,1479.68,1383.424,1423.36,2313.216,1361.92,1415.168,1397.76,1409.024,1512.448,1388.544,1302.528],[1605.632,1437.696,1444.864,1576.96,1531.904,1623.04,1544.192,1567.744,1569.792,1478.656,1383.424,1421.312,2312.192,1361.92,1415.168,1394.688,1408.0,1510.4,1388.544,1302.528],[1671.168,1436.672,1444.864,1577.984,1532.928,1623.04,1544.192,1567.744,1574.912,1475.584,1383.424,1424.384,2049.024,1361.92,1418.24,1395.712,1409.024,1510.4,1389.568,1302.528]],"semantics":"direct-source-issue-rank-work-wait","template_count":8,"timings_us":[1675.264,1437.696,1444.864,1577.984,1532.928,1623.04,1544.192,1567.744,1574.912,1479.68,1383.424,1424.384,2313.216,1361.92,1418.24,1397.76,1409.024,1512.448,1389.568,1302.528]},"stratified":{"category":"kill_condition_baseline","executed_event_count":2,"metrics":{"count":20,"iqr_us":12.8,"max_us":1048.576,"median_us":352.768,"min_us":302.08},"rank_timings_us":[[360.448,380.928,340.992,346.112,336.896,336.896,337.92,347.136,337.92,325.632,324.608,328.704,321.536,1006.592,415.744,416.768,316.416,318.464,338.944,291.84],[363.52,392.192,346.112,355.328,338.944,333.824,339.968,346.112,339.968,326.656,324.608,330.752,325.632,1038.336,429.056,420.864,325.632,327.68,352.256,302.08],[368.64,394.24,351.232,356.352,353.28,350.208,352.256,358.4,351.232,324.608,324.608,331.776,325.632,1005.568,427.008,421.888,325.632,326.656,350.208,302.08],[365.568,945.152,348.16,355.328,349.184,347.136,349.184,358.4,356.352,349.184,347.136,357.376,348.16,1048.576,429.056,424.96,352.256,352.256,352.256,302.08]],"semantics":"first-observed-per-collective-shape.v1","template_count":2,"timings_us":[368.64,945.152,351.232,356.352,353.28,350.208,352.256,358.4,356.352,349.184,347.136,357.376,348.16,1048.576,429.056,424.96,352.256,352.256,352.256,302.08]}},"request":{"format":"commcanary.qualification_request.v2","request_id":"3adf59a5a2edbdb333187de2c9fa29a9931df9e85a873a3b3479e8e7fed99b39"},"runtime":{"hostname":"toranj1.rostam.cct.lsu.edu","job_id":"178546","python_version":"3.12.3","runtime_nccl_version_code":22005,"torch_cuda_version":"12.1","torch_version":"2.4.1"},"samples_us":[1675.264,1437.696,1444.864,1577.984,1532.928,1623.04,1544.192,1567.744,1574.912,1479.68,1383.424,1424.384,2313.216,1361.92,1418.24,1397.76,1409.024,1512.448,1389.568,1302.528],"value_us":1462.272,"wall_time_s":6.854368694999721,"world_s